{
  "name": "Loop 1: Critical Path (UFS -> Spec -> Build)",
  "specs_dir": "coding-loops/loop-1-critical-path/specs",
  "test_state_file": "test-state.json",
  "model": "claude-opus-4-6",
  "max_attempts": 3,
  "auto_continue_delay": 3,
  "priority": 1,
  "health_check": {
    "enabled": true,
    "interval_seconds": 30,
    "file": "health.json"
  },
  "logging": {
    "transcript_tail_lines": 100,
    "max_transcript_chars": 50000
  },
  "metadata": {
    "created_at": "2026-01-07T00:00:00Z",
    "created_by": "manual",
    "tags": ["critical-path", "ufs", "spec-agent", "build-agent"],
    "description": "Critical path implementation: Complete UFS, build Specification Agent, build Build Agent"
  }
}
