{
  "name": "Loop 3: Polish (Monitoring -> E2E -> PWA)",
  "specs_dir": "coding-loops/loop-3-polish/specs",
  "test_state_file": "test-state.json",
  "model": "claude-opus-4-5-20251101",
  "max_attempts": 3,
  "auto_continue_delay": 3,
  "priority": 3,
  "health_check": {
    "enabled": true,
    "interval_seconds": 30,
    "file": "health.json"
  },
  "logging": {
    "transcript_tail_lines": 100,
    "max_transcript_chars": 50000
  },
  "metadata": {
    "created_at": "2026-01-07T00:00:00Z",
    "created_by": "manual",
    "tags": ["polish", "monitoring", "e2e", "pwa"],
    "description": "Polish implementation: Error Monitoring, E2E Testing, PWA/Mobile"
  }
}
